round	key	quality	delta	hit_rate	mrr	p95	regressions	status	verdict	note
1	consolidation_boost_resweep	0.5406	0.5406	0.6034	0.3939	151.5	0	keep	discard	consolidation_boost default (1.1) re-sweep now that temporal is gated separately — the global value may now move freely without the temporal regression that blocked it before
2	event_anchored_deboot	0.5502	0.5502	0.6207	0.3856	147.5	0	kept	discard	Apply narrow-window de-boost to event_anchored consolidations; 1.3 boost buries gold UNE Vibeke 27 april event; gate on window width like temporal path
1	consolidation_boost_once	0.5463	-0.0039	0.6034	0.4129	142	0	discarded	discard	Apply consolidation_boost to the FUSED cons score once after the RRF accumulation loop, not per-contribution: in _fuse() in yaams/retrieve/hybrid.py, accumulate raw RRF for each cons entry across all index contributions, then multiply by consolidation_boost a single time after the loop (or move the *= into _hydrate_consolidation on components.rrf_score). Current code multiplies every contribution inside the rank loop, effectively squaring the boost for dual-covered consolidations and giving them an unfair compounding edge over single-index gold items (evidenced by `medlemssak`, `russ`, `troika`).
2	bm25_magnitude_fts_blend	0.5517	0.0015	0.6034	0.4311	153.9	0	win	WIN	Blend normalized BM25 magnitude into the FTS item contribution in hybrid.py (_fuse/_stash): for FTS entries, add a term proportional to (best_bm25 - this_bm25)/range weighted small (alpha~0.05) on top of rank-RRF. Rationale: rank-only RRF discards lexical confidence — exact lexical match at rank-0 with high bm25 magnitude now outscores a marginal rank-0, directly targeting deployment/sleep…sheep/medlemssak golds.
3	vec_distance_magnitude_blend	0.5119	-0.0398	0.569	0.3788	157.9	2	revert	discard	Mirror the bm25_magnitude_fts_blend already in _fuse() for the vector lists: normalize each list's cosine distances (lower = better) to [0,1] and add alpha*normed_similarity*contribution to the RRF contribution for vec results. The current code discards the distance signal after ranking — a result at rank 0 with distance 0.05 and one at rank 0 with distance 0.45 get identical RRF contributions, even though the closer embedding is a much stronger match. Controlled by a new VEC_MAGNITUDE_ALPHA constant (suggest 0.05 to start). Scope: _fuse() in yaams/retrieve/hybrid.py, extending the existing is_fts branch with a symmetric is_vec branch.
4	bm25_attention_tokens_corpus	0.5463	-0.0054	0.6034	0.4129	154.7	0	crash	discard	In compute_bm25_scores, build BM25 corpus from attention_tokens instead of note_tokens. Tightens IDF signal around capsule fields but crashed; no improvement.
1	attention_bm25_secondary_blend	0.9064516129032258	0	0.9354838709677419	0.8870967741935484	263.7456908554319	0	neutral	discard	In compute_bm25_scores, build a secondary BM25Okapi instance over attention_tokens in parallel with the existing note_tokens scorer, then return a blended score: (1-alpha)*note_bm25 + alpha*attention_bm25, with alpha ~0.2. Configurable via LEDGER_BM25_ATTENTION_ALPHA.
2	tag_bm25_lexical_blend	0.896774193548387	-0.0097	0.9354838709677419	0.8709677419354839	286.3100309360532	1	revert	discard	In lexical_score_component() in ledger/query.py, replace the flat 0.30*tag_overlap ratio with a BM25-scored tag signal: build a BM25Okapi instance over the tag_tokens field of all candidates in the semantic hybrid pool, normalize scores to [0,1], then use alpha*normed_tag_bm25 (alpha~0.30) instead of the current binary-intersection fraction. Controlled by LEDGER_TAG_BM25_ALPHA env knob.
